{
  "days": 7,
  "count": 9,
  "typicalMin": 6,
  "typicalStoppedMin": 14,
  "longest": {
    "start": "2026-10-06T22:41:10.000Z",
    "durationMin": 23.5,
    "stopped": true
  },
  "hours": [0, 0, 0, 0, 0, 0, 0, 0.14285714285714285, 0.2857142857142857, 0, 0, 0, 0.14285714285714285, 0, 0, 0.14285714285714285, 0, 0.2857142857142857, 0, 0, 0, 0.14285714285714285, 0.14285714285714285, 0],
  "perDay": [1, 2, 1, 0, 2, 1, 2],
  "updatedAt": "2026-10-08T21:26:34.000Z"
}
