{
  "days": 30,
  "count": 0,
  "typicalMin": null,
  "typicalStoppedMin": null,
  "longest": null,
  "hours": [0, 0, 0, 0, 0, 0, 0, 0, 0, 0, 0, 0, 0, 0, 0, 0, 0, 0, 0, 0, 0, 0, 0, 0],
  "perDay": [0, 0, 0, 0, 0, 0, 0, 0, 0, 0, 0, 0, 0, 0, 0, 0, 0, 0, 0, 0, 0, 0, 0, 0, 0, 0, 0, 0, 0, 0],
  "updatedAt": "2026-10-08T05:00:00.000Z"
}
